{
  "schema_version": 1,
  "protocol_name": "ReliableBroadcastSafe",
  "params": [
    [
      "n",
      4
    ],
    [
      "t",
      1
    ],
    [
      "f",
      1
    ]
  ],
  "processes": [
    {
      "process_id": 0,
      "role": "Process",
      "events": [
        {
          "sequence": 0,
          "kind": {
            "type": "Init",
            "location": "Process_waiting[accepted=false,decided=false,decision=false]"
          }
        },
        {
          "sequence": 1,
          "kind": {
            "type": "Receive",
            "message_type": "cnt_Init@Process",
            "from_process": 0,
            "fields": []
          }
        },
        {
          "sequence": 2,
          "kind": {
            "type": "Transition",
            "from_location": "Process_waiting[accepted=false,decided=false,decision=false]",
            "to_location": "Process_echoed[accepted=true,decided=false,decision=false]",
            "rule_id": null
          }
        },
        {
          "sequence": 3,
          "kind": {
            "type": "Send",
            "message_type": "cnt_Echo@Process",
            "fields": []
          }
        },
        {
          "sequence": 4,
          "kind": {
            "type": "Receive",
            "message_type": "cnt_Echo@Process",
            "from_process": 0,
            "fields": []
          }
        },
        {
          "sequence": 5,
          "kind": {
            "type": "Receive",
            "message_type": "cnt_Echo@Process",
            "from_process": 1,
            "fields": []
          }
        },
        {
          "sequence": 6,
          "kind": {
            "type": "Receive",
            "message_type": "cnt_Echo@Process",
            "from_process": 2,
            "fields": []
          }
        },
        {
          "sequence": 7,
          "kind": {
            "type": "Transition",
            "from_location": "Process_echoed[accepted=true,decided=false,decision=false]",
            "to_location": "Process_readied[accepted=true,decided=false,decision=false]",
            "rule_id": null
          }
        },
        {
          "sequence": 8,
          "kind": {
            "type": "Send",
            "message_type": "cnt_Ready@Process",
            "fields": []
          }
        },
        {
          "sequence": 9,
          "kind": {
            "type": "Receive",
            "message_type": "cnt_Ready@Process",
            "from_process": 0,
            "fields": []
          }
        },
        {
          "sequence": 10,
          "kind": {
            "type": "Receive",
            "message_type": "cnt_Ready@Process",
            "from_process": 1,
            "fields": []
          }
        },
        {
          "sequence": 11,
          "kind": {
            "type": "Receive",
            "message_type": "cnt_Ready@Process",
            "from_process": 2,
            "fields": []
          }
        },
        {
          "sequence": 12,
          "kind": {
            "type": "Transition",
            "from_location": "Process_readied[accepted=true,decided=false,decision=false]",
            "to_location": "Process_done[accepted=true,decided=true,decision=true]",
            "rule_id": null
          }
        },
        {
          "sequence": 13,
          "kind": {
            "type": "Decide",
            "value": "true"
          }
        }
      ]
    },
    {
      "process_id": 1,
      "role": "Process",
      "events": [
        {
          "sequence": 0,
          "kind": {
            "type": "Init",
            "location": "Process_waiting[accepted=false,decided=false,decision=false]"
          }
        },
        {
          "sequence": 1,
          "kind": {
            "type": "Receive",
            "message_type": "cnt_Init@Process",
            "from_process": 0,
            "fields": []
          }
        },
        {
          "sequence": 2,
          "kind": {
            "type": "Transition",
            "from_location": "Process_waiting[accepted=false,decided=false,decision=false]",
            "to_location": "Process_echoed[accepted=true,decided=false,decision=false]",
            "rule_id": null
          }
        },
        {
          "sequence": 3,
          "kind": {
            "type": "Send",
            "message_type": "cnt_Echo@Process",
            "fields": []
          }
        },
        {
          "sequence": 4,
          "kind": {
            "type": "Receive",
            "message_type": "cnt_Echo@Process",
            "from_process": 0,
            "fields": []
          }
        },
        {
          "sequence": 5,
          "kind": {
            "type": "Receive",
            "message_type": "cnt_Echo@Process",
            "from_process": 1,
            "fields": []
          }
        },
        {
          "sequence": 6,
          "kind": {
            "type": "Receive",
            "message_type": "cnt_Echo@Process",
            "from_process": 2,
            "fields": []
          }
        },
        {
          "sequence": 7,
          "kind": {
            "type": "Transition",
            "from_location": "Process_echoed[accepted=true,decided=false,decision=false]",
            "to_location": "Process_readied[accepted=true,decided=false,decision=false]",
            "rule_id": null
          }
        },
        {
          "sequence": 8,
          "kind": {
            "type": "Send",
            "message_type": "cnt_Ready@Process",
            "fields": []
          }
        },
        {
          "sequence": 9,
          "kind": {
            "type": "Receive",
            "message_type": "cnt_Ready@Process",
            "from_process": 0,
            "fields": []
          }
        },
        {
          "sequence": 10,
          "kind": {
            "type": "Receive",
            "message_type": "cnt_Ready@Process",
            "from_process": 1,
            "fields": []
          }
        },
        {
          "sequence": 11,
          "kind": {
            "type": "Receive",
            "message_type": "cnt_Ready@Process",
            "from_process": 2,
            "fields": []
          }
        },
        {
          "sequence": 12,
          "kind": {
            "type": "Transition",
            "from_location": "Process_readied[accepted=true,decided=false,decision=false]",
            "to_location": "Process_done[accepted=true,decided=true,decision=true]",
            "rule_id": null
          }
        },
        {
          "sequence": 13,
          "kind": {
            "type": "Decide",
            "value": "true"
          }
        }
      ]
    },
    {
      "process_id": 2,
      "role": "Process",
      "events": [
        {
          "sequence": 0,
          "kind": {
            "type": "Init",
            "location": "Process_waiting[accepted=false,decided=false,decision=false]"
          }
        },
        {
          "sequence": 1,
          "kind": {
            "type": "Receive",
            "message_type": "cnt_Init@Process",
            "from_process": 0,
            "fields": []
          }
        },
        {
          "sequence": 2,
          "kind": {
            "type": "Transition",
            "from_location": "Process_waiting[accepted=false,decided=false,decision=false]",
            "to_location": "Process_echoed[accepted=true,decided=false,decision=false]",
            "rule_id": null
          }
        },
        {
          "sequence": 3,
          "kind": {
            "type": "Send",
            "message_type": "cnt_Echo@Process",
            "fields": []
          }
        },
        {
          "sequence": 4,
          "kind": {
            "type": "Receive",
            "message_type": "cnt_Echo@Process",
            "from_process": 0,
            "fields": []
          }
        },
        {
          "sequence": 5,
          "kind": {
            "type": "Receive",
            "message_type": "cnt_Echo@Process",
            "from_process": 1,
            "fields": []
          }
        },
        {
          "sequence": 6,
          "kind": {
            "type": "Receive",
            "message_type": "cnt_Echo@Process",
            "from_process": 2,
            "fields": []
          }
        },
        {
          "sequence": 7,
          "kind": {
            "type": "Transition",
            "from_location": "Process_echoed[accepted=true,decided=false,decision=false]",
            "to_location": "Process_readied[accepted=true,decided=false,decision=false]",
            "rule_id": null
          }
        },
        {
          "sequence": 8,
          "kind": {
            "type": "Send",
            "message_type": "cnt_Ready@Process",
            "fields": []
          }
        },
        {
          "sequence": 9,
          "kind": {
            "type": "Receive",
            "message_type": "cnt_Ready@Process",
            "from_process": 0,
            "fields": []
          }
        },
        {
          "sequence": 10,
          "kind": {
            "type": "Receive",
            "message_type": "cnt_Ready@Process",
            "from_process": 1,
            "fields": []
          }
        },
        {
          "sequence": 11,
          "kind": {
            "type": "Receive",
            "message_type": "cnt_Ready@Process",
            "from_process": 2,
            "fields": []
          }
        },
        {
          "sequence": 12,
          "kind": {
            "type": "Transition",
            "from_location": "Process_readied[accepted=true,decided=false,decision=false]",
            "to_location": "Process_done[accepted=true,decided=true,decision=true]",
            "rule_id": null
          }
        },
        {
          "sequence": 13,
          "kind": {
            "type": "Decide",
            "value": "true"
          }
        }
      ]
    }
  ]
}
